id,question
a7daa3fa-69db-42df-930c-19babbb440b8,How satisfied are you with the overall progress of the project?
1a93aa51-6d3f-49ed-8044-376418ca79e4,Rate the communication between team members on a scale of 1 to 5
26d46b3b-5d98-4715-9f63-2053bc60f32c,Did you find the project timeline realistic? Please rate from 1 to 5
987cd9f8-7c5d-452a-b1ea-7c6acec3cd16,How would you rate the quality of work delivered by the team?
cdcd19fb-995b-4096-9051-26db9c49b8fd,Rate the effectiveness of the project management on a scale of 1 to 5
9a5e7c95-a3f8-47ae-aa88-4f03c74c74e0,Were the project goals clearly defined? Please rate from 1 to 5
8e28412a-0615-47aa-8ea1-5ca5f2ce8f18,How satisfied are you with the level of collaboration within the team?
ce7311c4-37a8-42e4-8c9b-769c6d7c7ab1,Rate the accuracy of the project budget estimation from 1 to 5
5fb5b911-697a-4db2-911f-98a122d4aa17,Did the project meet your expectations? Please rate from 1 to 5
63805f7e-1d87-4bca-b399-c7b5f44be9ea,How would you rate the problem-solving skills of the team?
e3cbbeee-1128-44cc-9035-84fe9ec90622,Rate the level of stakeholder engagement on a scale of 1 to 5
f677327c-2bac-4f2b-a47f-bf7eaa26a2ab,Were the project risks effectively managed? Please rate from 1 to 5
c1659b89-de55-4809-852c-fda17706ce41,How satisfied are you with the project deliverables?
c4f3a491-154c-40d3-9b1d-e371e8e3e2bd,Rate the level of innovation demonstrated in the project from 1 to 5
4a298b02-3690-4f9a-82dd-8cda5a0c755f,Did the project meet the specified deadlines? Please rate from 1 to 5
fd1cf0fa-a517-4162-b79b-9a1364270dbd,How would you rate the level of client satisfaction with the project outcomes?
ddeae3af-96cf-4479-84ef-cab92571fe97,Rate the effectiveness of the project feedback mechanisms on a scale of 1 to 5
0e78568a-6191-4a81-b0b9-a52469ba56c1,Were the project resources allocated efficiently? Please rate from 1 to 5
99e1e3ad-a8d1-460d-ba60-96a568e69dd1,How satisfied are you with the level of transparency in project communication?
31f00a14-14be-418a-91e9-d29c69708edd,Rate the level of adaptability shown by the team members on a scale of 1 to 5
